root@COMP3134-Winter26:~# tcpdump -n -i eth0
tcpdump: verbose output suppressed, use -v[v]... for full protocol decode
listening on eth0, link-type EN10MB (Ethernet), snapshot length 262144 bytes
17:38:44.787800 IP 138.197.128.144.22 > 184.148.104.118.57810: Flags [P.], seq 89853978:89854166, ack 480407240, win 2077, length 188
17:38:44.811190 IP 184.148.104.118.57810 > 138.197.128.144.22: Flags [P.], seq 1:37, ack 188, win 4091, length 36
17:38:44.811383 IP 138.197.128.144.22 > 184.148.104.118.57810: Flags [P.], seq 188:224, ack 37, win 2077, length 36
17:38:44.843081 IP 184.148.104.118.57810 > 138.197.128.144.22: Flags [P.], seq 37:73, ack 224, win 4091, length 36
17:38:44.843263 IP 138.197.128.144.22 > 184.148.104.118.57810: Flags [P.], seq 224:260, ack 73, win 2077, length 36
17:38:44.875449 IP 184.148.104.118.57810 > 138.197.128.144.22: Flags [P.], seq 73:109, ack 260, win 4091, length 36
17:38:44.875618 IP 138.197.128.144.22 > 184.148.104.118.57810: Flags [P.], seq 260:296, ack 109, win 2077, length 36
17:38:44.887613 IP 138.197.128.144.22 > 184.148.104.118.57810: Flags [P.], seq 296:1172, ack 109, win 2077, length 876
17:38:44.894605 IP 184.148.104.118.57810 > 138.197.128.144.22: Flags [.], ack 1172, win 4095, length 0
17:38:44.895424 IP 184.148.104.118.57810 > 138.197.128.144.22: Flags [P.], seq 109:145, ack 1172, win 4095, length 36
